{
  "id": "cheat_sample_placeholder",
  "category": "misc",
  "effect": {
    "en": "Sample cheat used to validate the pipeline before launch. No real codes exist before release.",
    "fr": "Cheat factice servant à valider le pipeline. Aucun code réel n'existe avant la sortie."
  },
  "sequence": {
    "ps5": ["up", "up", "circle", "l1"],
    "xbox": ["up", "up", "b", "lb"]
  },
  "blocksTrophies": true,
  "status": "draft",
  "verifiedBy": ["internal:fixture"]
}
